{
  "version": "0.2.7",
  "releaseUrl": "https://github.com/itzmonnz/phwgna-stv-updates/releases/download/v0.2.7/phwgna-stv-0.2.7.zip",
  "sha256": "48a6f31edd6cdb58502259be7ce9333fd743f38c19e21387892ac9b1535c5565",
  "publishedAt": "2026-09-06T12:14:04.670Z",
  "signature": "ywztW5g7so2x+MaU3fkf7/QZBZ352ON1EsL/GY5KChzNgaMbhBQ2AubopGEVoYyUp/39fqJXmQ+4Wz2e5yPJCw=="
}
